{
  "v": "ACDCCAACAAJSONAAQy.",
  "t": "acm",
  "d": "EJ3mR7gLTFwVkTAKeZWLP8wTrYVg8gBErHZ883kg7b3C",
  "u": "0ABzZWRpYXV0aHpub25jZTAw",
  "i": "EIaSWASllNlAuAFcDG1xbXGEkVw_oL0CX8_o1XkFTegY",
  "rd": "EDDDDDDDDDDDDDDDDDDDDDDDDDDDDDDDDDDDDDDDDDDD",
  "s": "ELSG-UTE1csyti500RHkMj8n7vvAJdGg5cyQ7vyoImrP",
  "a": {
    "d": "EESPLXiM5wnzuFTDxleqe5yMa5IarrgA-IUIXYHrAyOm",
    "u": "0ABzZWRpYXV0aGF0dG5vbmNl",
    "i": "EKr8JLtfqWCmHrxO3yu8ocS2n9o0Tlspeaqm9ZOf3FM1",
    "authz": {
      "rc": [
        {
          "route": "health/records",
          "caps": [
            "read",
            "message"
          ]
        }
      ]
    },
    "issuedAt": "2026-09-01T12:00:00+00:00"
  },
  "e": {
    "d": "EBDFg4dKqfcKfQxDCaIOAutjJQp9yuJmj8oB6yVf-QDt",
    "u": "0ABzZWRpYXV0aGVub25jZTAw",
    "authority": {
      "d": "ED4CYGQqdRuQK3F0jUEHkLIRuNvEdmmpSLisixn4bsl9",
      "u": "0ABzZWRpYXV0aGVkZ2UwMDAw",
      "n": "ENTwQxDFnVXigOTcymAXSHCgl26a0p3POYiRFnTL1lb0",
      "s": "EDJzXg34opr6-odFix6lpiccfHF7ksITHuIES_MQRH4b",
      "o": "I2I"
    },
    "subject": {
      "d": "ELLSoFH_w8vjTJf8K4VX59d5ZjtH1gxlWGa8edeMCMDW",
      "u": "0ABzZWRpYXV0aGVkZ2UwMDAx",
      "n": "EO2_WbE5hiB3HpwD2XDQShBDXSLsh7cYaIil_pWOBplX",
      "s": "EN0JtdzBmFuTUzyJG9CXZhtdu-bW0V6L95bsVBzi-cY-",
      "o": "E1E"
    }
  },
  "r": "EKLBoGWUawixiHtnA5LZ23cPfWjG1niiLlRIhDUGmHRz"
}
